review_id,review_text
GV9gHxszRwtX0YJrToA7SQ,ホテルから近くのダイバーシティでガンダムを見て、そのまま夢の大橋やレインボーブリッジを散策してきました。久々の休日を満喫できてよかったです。ホテルのランチも美味しかったです。また、宿泊したいです。
rNIQ0aiTv96fG1kexYkGxg,きれいで助かります。
HWNOkHs8vlGrk76pArxGRA,コンビニの営業時間が短く、周辺にないことはマイナスでした。
pPLFFGBeAZctOnhvRvnDlw,駅近で綺麗でした。また機会があれば利用したいです。
UdVAQDTr8PKyhr9edVpQng,翌朝の早朝便の飛行機に備えて1泊しました。朝5:35発の空港行きシャトルバスに乗るつもりでしたが、寝坊してしまい（起きたのが5:55）、慌てて京急で空港に向かいましたが、幸い6:25頃チェックインでき、6:45発の飛行機に間に合いました。なんといっても空港へのアクセスがいいですね。ホテル自体はとてもきれいで、大浴場も十分な大きさの浴槽で気持ち良かったです。
Y5sBmbHpuhZlJf6W2Y5gIw,部屋は広めで鏡があちこちについていて、綺麗で良かったですし、大浴場も良かったです。送迎バスもあって助かります。朝食は、エッグベネディクの卵の冷たさが残念でした。卵が温かければもっと印象が違ったと思います。その他の内容を考えると値段がお高めに感じてしまいました。
KaHxiLyGzrCVYVHiov6N1Q,概ね満足しましたが、化粧水や乳液のアメニティがあると嬉しいです。
qXoHqVNl7jT2CEEC2vQC2A,お店が周囲にたくさんあり、便利なホテルです。
hZEiemwFfKuzsmurIKaSMg,2月15日に宿泊しましたが、駅近で便利でした。
Jzl_bVc_eV-QhWJKeNTx5g,悪かった点フロントスタッフ一人愛想が無くて気分悪かった。トイレにホコリが溜まってて目立つ。部屋にお水のサービスがない。スタッフによっては英語が通じない。良かった点景色がいい。フロントの雰囲気がいい。ホテル専用エレベーターコンビニと駅がある
1sRxyKfmrqBvNYSQMghWHg,16階のロビーは高級感があって綺麗。フロントの方の説明は無表情でロボットのようでした。ちなみに隣で説明されてた方は笑顔で印象良かったですが、、、笑ロビーと違って、客室は簡素。入室して、手を洗おうとユニットバスの扉を開けて驚愕。床と壁に、大小のゴキ〇リが、7～8匹。。。壁と床を少し叩いたら、隙間にコソコソと消えていきました。（すぐに外出の約束があって出掛けなくてはいけなかったのと、ホテルに言って部屋替えてもらったところで「そこら中にいるものはいるので意味ないかな」と思って伝えませんでした。）まあ、どこのホテルでもいるんでしょうが、さすがに数がビックリでした。一度、駆除でも入れた方が良いのでは？
ro72go5I8dFidG6PCjIubg,部屋は広く眺望も素晴らしい。駅からも近く、それでいて混雑さは感じなかった。ベッドが良かったおかげか、グッスリと寝れた。朝食は眺めの良いテーブルで非常に美味しく頂けた。次もぜひとも利用したい。
3VC6ZsQL8P42uimB7C6K3g,2月に宿泊しました。久しぶりの小田急センチュリーサザンタワーの宿泊でしたが、今回もとても気持ち良く宿泊できました。大好きなホテルです。景色、夜景ととても良いし、朝食も良い眺めを見ながらで気分が良いし、スタッフの方たちの対応もとても良くてほんとにゆったりと過ごせました。また、もっとゆったりしに、いろんなお食事などを楽しみに来たいです！
ph6mRJJMAd48XTZKJHYc1w,私にとって一番の魅力は、立地です。私の常宿になっています。ビジネス目的ですが、ネット環境とか満足しています。ただ最近混雑していて、予約が難しくなっていること、金額上がって来たことが残念です。本当はツインの部屋のシングルユースが、仕事のしやすい机があってよかったですが、満室で、ざんねんでした。
DmthirR-GrGvTRM0sNdMVg,22024.02.21に一泊しました。駅近、地下にコンビニ、レストランがすぐ近くにあるのでとても便利です。22階のパーティールームで同窓会が開催されましたので、仲良し3人でそのまま宿泊しました。夕食は地下にコンビニがあるので、海苔巻きビールなど買っておしゃべりに突入しました。朝食は20階でビュッフェ。厳選された食材で調理され、その場で作ってくれるミックスオムライスとても美味しかったです。そしてお土産は駅までの道に美味しいパン屋さんがあり、おすすめです。
N7ZNFbQapR8N8XY1hU4TOA,今回で3回目の利用となります。新宿駅からのアクセスも良く、客室も高層階で満足ですが朝食が値段の割には普通なのでもう少し良ければと思います。概ね満足です。
d9qjG5i30slQeqx_tD6eMQ,古いです。エアコンの効きが良くなかった。少し寒かったです。駅近で便利なので、古さを我慢できれば問題ないです。
1-d5jp0F_WJAoe-G0uKgNQ,子供の受験に付き添うため利用した。平日だったが割高のようで、「朝のステーキ」に魅力を感じてここに決めた。サイトの画像からすると「ステーキバイキング？」と思わせるような作りで、私もそのつもりだった。実際は「おひとり様1皿まで」とわざわざ会場に貼ってあり、外国人にも多く聞かれたのか英語表記もあった。画像のような美味しそうな肉ではなく、薄くて小さい、大量の油で焼かれてギトギト、鉄板の焦げが肉にまみれている。2日目はとても食べる気になれないので「朝食抜きにしてほしい」と申し出たが、できなかった。ドリンクバーの画像ともに、誇大広告で予約させられた感じで悔しい。フロントスタッフさんは笑顔で対応してくれたのが救いだったかもしれない。部屋については、テレビ裏のコンセントはものすごい数のタコ足配線で、ほこりも多くいつか時になってもおかしくないのでは？と思った。冷蔵庫は２０年くらい前のものらしく、また中の調整ダイヤルが外れていて操作できなかった。バストイレの換気扇が付かないので、トイレを使用した後の臭い消しができなかった。入浴中の息苦しさも解消できなかった。
LX_nM9vSvCF60i9od-n9zg,少し分かりにくいけど、駅近い。行き方はホテルのホームページに詳しく書いてあるので、問題なし。近くにコンビニが少ないので、注意が必要。
vrgp1Z2yfQAOpiaBBVAndQ,初めて利用しましたが駅から近く便利でした。ただ予約するのに前に見た評価(コメント)通り建物全体　部屋などは古さが目立ちましたが、思っていたよりは綺麗にされていたと思います。窓のところに荷物が置けるのはありがたかったです床に置くのに抵抗のある物　大き目の手提げバッグ　お土産など机の上に置くと邪魔になるので助かりましたただ壊れて使えない照明は邪魔なので取り外した方が良いと思います
AJcY1K9FqjUckcJEthymyw,少し入り口は分かりにくいですが、駅に近く、便利な場所です。食事の場所も周辺にたくさんあります。前の道路の音が少しうるさくて同伴者が寝づらかったようです。朝食場所がそれ以外の時間はフリールームになっており、飲み物もあって時間つぶしに便利でした。今回は利用できませんでしたが、フロントのフロアにマンガが用意されていて、比較的新しめの話題作も多かったように思います。
uJmrw3zfcYvwI08fbjltig,初めて宿泊しましたが、本当に立地が良く、今回のお部屋からは東京タワーも見れたので大、大満足です。お風呂、トイレも別々なのでそこも良かったです。女性のアメニティの説明が分かりにくいかったというか、壁に書いてる事に気が付かなかったのでチェックインの時に口頭で教えて頂けるとありがたいです。次回も利用したいホテルです。
VjnEOr9w33rMY4q6IVLRDA,とてもいいホテルでした。ビジネスホテルとしては部屋が広いですし、清潔で機能的、とても使いやすい部屋でした。最近の東京のホテルの価格は上がる一方の中、お手頃に泊まれてあのレベル、大満足です。窓の目の前に東京タワーが見える部屋なのもラッキーでした。また泊まりたいと思います。
a7pm4Xy0InD6xVxjLJI47A,何度も利用させて戴いてます。女性1人でも安心出来るホテルです。
QRD2AVLGi37JhRCPkbxjaA,部屋は広く、お風呂は洗い場があってとても良かったです。眺望が良くなかったです。
NTmezj3gG0UhbinM3xG8bg,東京タワーが見える素敵な部屋でした。スーツケース2台十分に広げることができる広さです。コーヒーが2階のフロントから何回でも頂けます。近所にたくさん食事するところもあります。立地も良かったです。
GAD2khZ3j1M6umgnxCdpug,２月２５日宿泊しましたとにかく部屋からの眺望が素晴らしい皇居が近くなので大都会だけど緑がいっぱい庭園も良く整備もされていますバルコニーから富士山も見えて清々しかったです従業員の方々も優しく丁寧でした。ありがとう
bsvyBxd_Em5Hn8WXFeKPiQ,２月１７日土曜日に宿泊しました。翌１８日の日曜日の昼に開催の大学の同門会に出席のための前泊でした。朝食付きのホテルならビジネスホテルのランクで良かったのですが、妻が生涯に一度でいいからデラックスホテルで贅沢をしてみたいと言うので、パレスホテルを確保しました。私たちにとってはとても高価なホテルでしたが、バルコニー付きで、皇居前の広場や、見える夜景の素晴らしさに感激しました。アメニティも充実していて問題なく、朝食バイキングも品数、質も高く、ゆっくりと味わうことができました。いつまた今度、このような贅沢なホテルライフを送れる日が来るかは分かりませんが、妻は年に１回くらいこんな贅沢がしたいと言って、大満足でした。パレスホテルに感謝です！
OYcC7_MZFLmF-Tzo_xO1iw,初めて宿泊しました。クラブフロアで、アフタヌーンティーを楽しみに伺いましたが、全てブッフェに変わっていました。これはこれで、好きなものを食べられてよかったです。お部屋もバルコニーからの眺望は素晴らしく、とてもリラックスできました。またお邪魔したいと思います。
VJh4wlPGqPwDCM5pn5Q-yA,また宿泊したいです！和定食にしましたが、とってもおいしかった。
SiW2UYk_Z6YJ4YC1vICuIw,東京を代表するホテルとして高い評価を受け、都心とは思えない素晴らしい眺望を臨むことができるこちらのホテルに、以前から宿泊してみたいと思っており、今回初めて宿泊しました。クラブラウンジを利用しました。アフタヌーンティーやイブニングカナッペでは、フードが少し少ないと感じる部分はありましたが、スタッフの皆さんの気遣いもちょうどよく、快適な時間を過ごすことができました。しかし、翌日の朝食のときには状況が一変しました。スタッフは前日とはほとんどが違う方でした。狭めのクラブラウンジは混み合っており、特に3人以上で利用できる席は常に空きがありませんでした。食事を頼んでも提供されるのが遅く、ドリンクに至っては、２回も忘れられました。ビュッフェ台の食事も補充されず、ほとんどない状況のときもありました。そして、何よりも朝食時に不愉快であったのが、スタッフの「カツ　カツ」というヒールの音です。前日は気になりませんでしたが、混み合い、忙しかったせいもあるのかスタッフの方がヒールで歩き回る音が響き渡り、優雅に過ごせる雰囲気ではありませんでした。これまで宿泊したどのクラブラウンジよりもひどい状況だと感じました。また、宿泊した部屋もエアコンの音がうるさかったり、スピーカーが起動しなかったりという不具合がありました。期待が大きすぎたのかもしれませんが、とても楽しみにしていただけに非常に残念でした。
7RkzozQS8FU2OnuFavAfuQ,この頃になって完全にアパ派になりました。夕焼け時の夜景は恐ろしいくらいにキレイでびっくりしました．みなとみらいの風景から赤焼の富士山まで。快適すぎます
phquKKTjQFeiO0WHTl4GKQ,大きな大浴場があり、朝7時頃に入り出勤した。疲れも、寝ぐせも取れて良かった
xWSs95-e2w4COn5eiMxJ9A,立地が良く、大浴場が清潔で大変ゆっくり出来ました。食事無しプランだったのですが疲れていた為、夕食朝食共にホテル内で頂きましたが、多少でも宿泊者割があれば良かったです。
fDk5JKKE3DAIMaWF0wnLLg,眺めがよく、朝食もおいしかった
qoAAZLrygbSYVhQa19zrqA,お部屋からの眺めは　とても素敵でした。何かを建設中のものが見えましたので、この先　視界はどうなるのだろうと　気になりました。トイレの座るところが　ヒヤッとして冷たく、これは　どうにかならないものでしょうか大浴場を始めて利用しました。とても　気持ちよかったです三階のレストランも　初めて利用しました。良かったです
P2ZH4FpmGpdQcqyJgmxtjg,ホテルの館内がアロマの香りがして凄く癒やされました。朝食も種類が多く大変美味しくいただけました。一つ残念だったのは、朝温まりたくて入ったお風呂ですがお風呂の温度がぬるすぎて（体感的には38℃位）熱いシャワーで身体を温めました。お風呂も楽しみにしてたので非常に残念でした。お風呂の件を除くとまたお世話になりたいと思っております。
nLLfI6-3OALPHZAMHUV39A,部屋も綺麗でレディースルームの為、ドライヤーやスチーム美顔器もあり充実していた。朝食も美味しかったです。
Di89CYFb6BAiGYlp1BFraQ,部屋はお任せプランでしたが、ひとり利用で2段ベッドは落ち着かなかった。
baA-EAa66foXFZjpHzsFYw,駅にまーまー近くコンビニも近い、朝食は別でしたので今回はいただきませんでした。プレミアという割に部屋の広さは普通のスーパーホテルと変わらず朝食も別なのでプレミア感はないかも。天然温泉とはいえ循環加温なので消毒の匂いがきつ過ぎて気になりました。
qbK6qSLla-fAZ1VbRviVYw,久しぶりに利用させていただきました。やはり温泉は、気持ち良かったです。欲を言えば、せめて浴場には櫛などを置いて欲しいと思います。
KGn0SyeWzaNl1OEv4m3ZeQ,いつも素晴らしいサービスありがとうございます。新横浜では施設、サービス、そして価格のバランスが一番いいホテルだと思います。今後ともよろしくお願い申し上げます。
hsNGRbh897nkfnaUxTsFoQ,ハイグレードなエントランス、吹き抜けの通路、非日常的なステイを楽しみました。朝食のレベル非常に高く、満足のいくものでした。また、お世話になりたいと思います。
nxXSqx-j5VbW9avaEUNUtQ,新横浜駅のすぐそばで立地的には問題ありませんでした。思ってたより部屋が狭かったかな。
gePAN0Y2KX7DCo-07eBDEQ,コスパは以前より悪くなった。海外の宿泊者が多くなってきたと感じますね。
HOS1dLk7yzSurGPkH5UG-g,駅からすぐでとても楽ちんだし、なにより景色がとても良かったです。お風呂も綺麗でとても清潔感がありました。事前にお願いしていた加湿器も準備されていて、文句なしです！
HEGiFVq9sK_6A1XH9kKugw,wifiの速度が遅くビジネスでは利用は難しく感じました。また、火災警報が夜分になりましたが、仕方ないにせよ、受験生も見受けられたので、何らかの配慮は必要だと感じました。
xZXhcPUJVZ9bDmgMHS4xXA,三点独立なのがとてもいいです。本当に部屋みたいで落ち着きます。これからも横浜に泊まるときは使いたいと思います。
Hk3vinoaeu8jXis74rjhMA,連泊しました。駅から近くて便利。施設は清潔感がある。連泊する場合は、同じ朝食メニューに飽きるかも。浴槽の清掃ができていなかったのがひとつ残念でした。
pbhwPOvc000oWQWgmGHNMQ,駅近で、このお値段はとっても良心的かと思います。部屋も思ったより広くて快適でした！お風呂、トイレ別だし、綺麗でした！セキュリティもしっかりしてると思います。また横浜に行く機会があれば利用したいなと思います。
